{
  "id": "example.museum:concept/memex",
  "title": "Memex",
  "type": "concept",
  "importance": 5,
  "summary": "A proposed associative knowledge system described by Vannevar Bush.",
  "relationships": [
    {
      "id": "example.museum:rel/artifact-represents-concept",
      "type": "represents",
      "source": "example.museum:artifact/memex-illustration",
      "direction": "incoming"
    },
    {
      "id": "example.museum:rel/artifact-context",
      "type": "example.museum:curatorial_context_for",
      "source": "example.museum:artifact/memex-illustration",
      "direction": "incoming"
    }
  ]
}
